{
  "strategyID": "STR-004",
  "title": "Predictive Track Maintenance Program",
  "description": "Implementation of AI-powered track defect prediction system to transform maintenance operations",
  "purpose": "Reduce track-related accidents by 35% through early detection and predictive maintenance",
  "owner": "Director of Track Technology Innovation",
  "orgUnitTitle": "Technology Innovation Division",
  "strategyCategory": "corporate",
  "strategyType": "disruption",
  "strategicFocus": "innovationLeadership",
  "timeHorizon": "longTerm",
  "scopeLevel": "organization",
  "objectives": "Deploy sensors on 85% of mainline track by 2026, achieve 92% prediction accuracy",
  "keyActivities": "Sensor installation, data integration, AI model development, staff training",
  "resources": "$145M budget, 23 technical staff, 4 AI systems, cloud infrastructure",
  "timeline": "36 months: 2024-2026",
  "keyPerformanceIndicators": "Defect prediction accuracy: 92%, False positive rate: 3%, ROI: 15%",
  "dependencies": "Track geometry systems, weather monitoring network",
  "relatedStrategies": "Digital Track Inspection, Rail Stress Monitoring",
  "risks": "Sensor reliability in extreme weather, data quality issues",
  "riskCategories": [
    "technology",
    "operational",
    "financial"
  ],
  "mitigationStrategies": "Redundant sensor deployment, enhanced data validation",
  "strategicAlignment": "Directly supports 25% accident reduction goal",
  "competitiveAdvantage": "Industry-leading predictive maintenance capabilities",
  "marketPosition": "marketLeader",
  "investmentLevel": "highInvestment",
  "successCriteria": "25% reduction in track-related incidents, ROI > 15%"
}
